scheduled_date,scheduled_time,network,text,notes
2026-05-28,09:15,linkedin,"We publish prices in five currencies.
Nobody else at this tier of the market does.

Palvento has three tiers: 59, 159, 499. You can toggle the page into USD, GBP, EUR, AUD or CAD. What you see is the price you pay. No conversion fees pushed to the invoice. No ""contact us for local pricing"". No quote form.

I thought this was a table-stakes decision when I made it. I was wrong. Every enterprise competitor hides their price behind a form. Every self-serve peer publishes in USD only. The entire middle band of the market — operators in London, Sydney, Toronto, Berlin, Milan — is asked to do currency math and accept foreign-exchange risk as a pre-condition of signing up.

We are a UK-registered company selling mostly in USD. There is no particular reason this should be easier for a London seller than a New York one. So we built the currency toggle into the pricing page, made it sticky across the site, and priced each currency to a clean number in that currency — 159 USD becomes 129 GBP, 149 EUR, 249 AUD, 219 CAD. Not a conversion. A price.

This took two days to build and has become a line item at every discovery call. ""You're the first tool that actually tells me the GBP price"". Small detail, high signal. Boring choices compound.

#Pricing #SaaS #Shopify #Global","Week 6 Post 17 — Product — Visual: A pricing card mocked in five versions side by side — same layout, different currency labels. A small toggle at the top shows the currency chip."
2026-05-29,10:00,linkedin,"If you're running Shopify plus more than one marketplace, do this one exercise this week.
It takes an hour. It changes the business.

Pull the last 90 days of orders from every channel into one spreadsheet. One row per order. Columns: channel, SKU, list price, fees total, shipping cost, COGS, net contribution.

You are going to hate every minute of building this. That's fine. It is the ledger question most operators duck.

When you are done, sort by net contribution per unit, descending. Three things will happen.

One. Your top-three SKUs on Amazon will not be your top-three SKUs on Shopify. The feeds are different. The audiences are different. Your catalogue is quietly running two businesses.

Two. At least one channel will have at least one SKU contributing negatively. Almost always it is a low-priced item with high fulfilment cost on a marketplace with heavier fees. You have been paying to ship it.

Three. Your hero SKU — the one you tell yourself is the business — will contribute less than you think, because ad spend and returns have not been allocated to it.

This exercise is the P&L the platform replaces. Running Palvento means you don't rebuild this spreadsheet every quarter. But do it once by hand, because what you learn is usually a pricing decision worth more than a year of subscription.

#Ecommerce #Margins #Shopify #Operations","Week 6 Post 18 — Tactical — Visual: A spreadsheet-style screenshot with six columns visible, one row highlighted green (top contribution), one highlighted red (negative). Hand-drawn circle around the negative row."
2026-06-02,08:30,linkedin,"Everyone is talking about AI-drafted listings.
The real feed bottleneck in 2026 is not the drafting. It is the validating.

Every feed tool in the market has an AI listing drafter now. Palvento does too. So does every competitor within three clicks of a Google search. It is table stakes.

The problem is that a perfectly drafted listing still gets rejected. AI-drafted or human-drafted, the feed has to pass per-marketplace compliance — GTIN format, category attribute completeness, image specs, banned words, policy IDs, condition values, ship-from address validation. A listing can be beautifully written and still get suppressed for a 13-digit identifier missing a check digit.

So the differentiator in 2026 is not ""we can write a title"". Everyone can write a title. The differentiator is ""we catch the 12 reasons the title won't work before it ships"". That is validator work. It is harder than it sounds because the per-marketplace schemas change quarterly without notice, and every tool maintaining a validator is doing catalogue research every month to stay current.

If a feed product is only pitching AI drafting, they are pitching the easy half of the problem. Ask about the validator. Ask when the schemas were last updated. Ask which rejection patterns they catch at ingest. That is where the real engineering lives.

#AI #Ecommerce #Shopify #Commerce","Week 7 Post 19 — POV — Visual: A two-column comparison. Left: ""AI drafting — easy"". Right: ""AI validating — hard"". Bottom caption: ""the one that matters is on the right""."
2026-06-04,09:15,linkedin,"A month ago I almost shipped a feature that would have killed the positioning.
Saying no is the product decision I get wrong most often.

The feature was a shipping-label integration. Our top ten trialists had asked for it — which in early-stage product is usually the signal that you should build it.

The problem was that shipping is not feed management. Shipping is a whole product — label pricing negotiation, carrier integrations, returns portal, manifesting, rate shopping. Zonos does it. ShipStation does it. Sendle does it. Every one of them has a team of forty on the problem and we had one engineer considering how to fit it in between the TikTok Shop compliance work.

If we had shipped a bad shipping feature, three things would have happened. One — we'd have owned support for a workflow we didn't actually control. Two — the wedge positioning would have slipped from ""feed management"" to ""vague multichannel tool"", the exact phrase the positioning doc explicitly bans. Three — every prospect evaluating us against Shipstation would have asked us to be ShipStation, which we would have lost.

I almost built it anyway. The thing that saved me was a 90-minute call with an operator who said ""honestly I just want the feed to be clean, I will buy ShipStation separately"". That one sentence killed the feature.

The hardest part of positioning is saying no to customers you like.

#Product #SaaS #Shopify #Founders","Week 7 Post 20 — Narrative — Visual: A photograph-style note pinned to a corkboard, reading ""feature killed, March 2026"". Handwritten."
2026-06-05,10:00,linkedin,"Shopify App Store is the single highest-leverage acquisition channel for multichannel tools in 2026.
Most vendors are underinvesting in it.

Every Shopify operator I have spoken to — every single one — found at least two of their current tools through the App Store. Not Google. Not G2. Not LinkedIn ads. The App Store.

This should be obvious. Shopify builds a tightly-curated catalogue of apps, ranks them on install volume and review quality, surfaces them at the exact moment an operator is in the admin considering a new workflow. The intent signal is as clean as it gets in software.

And yet. Most multichannel tools I have audited rank poorly in the App Store. Some do not appear at all. Some have listings from 2022 with outdated screenshots. The enterprise feed platforms do not have a current App Store presence. Not one of them. The entire enterprise tier has decided the App Store is below them. Meanwhile Shopify's own first-party sync ranks first on nearly every multichannel query — because nothing at the paid tier is contesting it.

For the wedge we are targeting — Shopify-led operators running three-plus channels — ranking in the App Store is worth more than an enterprise sales team. We are investing in the listing, the reviews, the onboarding video, the uninstall-to-support conversion flow. Every week the App Store is the top traffic source on the site. Every other acquisition channel is a supplement.

The App Store is where the wedge is won or lost.

#Shopify #AppStore #SaaS #Commerce","Week 7 Post 21 — POV — Visual: A mocked-up App Store screen with four app tiles. One tile highlighted with a subtle glow. Caption: ""ranking #3 for multichannel""."
2026-06-09,08:30,linkedin,"TikTok Shop's policy updates in Q1 2026 broke half the feed integrations in the market.
This is why the validator matters.

In February TikTok Shop tightened the category schema for Beauty and Personal Care — new mandatory fields for ingredient lists, new image-ratio rules for product-first vs lifestyle shots, and a rebuilt banned-word list for claims around skincare.

If you were a seller in that category and your feed tool had not updated its validator, you woke up to silent rejections. Your existing listings remained live, but any edit or new product got suppressed. Support queues at two of the major multichannel apps hit three-day response times. One app's team apparently did not know the schema had changed for six weeks.

TikTok Shop will do this again. So will Amazon. So will eBay. Marketplace schemas are not a one-time integration. They are a quarterly maintenance burden. The validator inside the feed tool has to be updated by someone whose job is to read policy notes and translate them into schema code.

At Palvento, category-schema monitoring is on a named engineer's calendar every week. Not because it is glamorous. Because if the validator drifts, the product is broken in a way the user will not discover until they list a new product and are silently rejected.

When you are evaluating a feed tool, the question to ask is not ""does it support TikTok Shop"". The question is ""who updates the TikTok Shop schema when it changes, and how quickly"".

#TikTokShop #Ecommerce #Shopify #Compliance","Week 8 Post 22 — POV — Visual: A calendar grid showing ""schema change"" markers sprinkled across Q1 2026. A single bold box around February labelled ""TTS Beauty v3""."
2026-06-11,09:15,linkedin,"We ship v1 publicly in 11 days.
Here is what made the cut, what did not, and what I am still nervous about.

In the cut. Eight channels. Pre-flight validator for Amazon, eBay, TikTok Shop, Etsy. Category suggester. Per-channel pricing floors. Variant groups. Five-currency pricing. eBay policy auto-provisioning. Per-channel P&L with line-item fee attribution. Shopify App Store install.

Not in the cut. Shipping-label integration. Automated repricing. A mobile app. Native Amazon PPC management. A public API beyond the read-only reporting endpoints. These are fair follow-up asks. None of them fit the wedge sentence.

Still nervous. Support capacity. A good Shopify App Store launch attracts 150 to 300 installs in week one, and roughly 40 percent of them will ask a question within 72 hours. I have one founder, two contract engineers, a support doc, and a fast Intercom. If we ship above 200 installs and a single bug creeps into week one, we will feel it.

What I'm most proud of. The pricing page in five currencies. The validator catching missing GTINs at ingest. The onboarding flow that gets a Shopify install to a live Amazon sync inside twelve minutes measured on 38 test runs. Every one of those was a small decision that compounded.

If you are reading this and you fit the shape — Shopify-led, three to five channels, somewhere between ""the free first-party sync is not enough"" and ""the enterprise tier just quoted me 2,500 a month"" — reply or DM. You are exactly the operator we built this for.

#Launch #Shopify #BuildInPublic #SaaS","Week 8 Post 23 — Narrative — Visual: A handwritten-style launch checklist on cream paper. Four boxes ticked. One box left open labelled ""you""."
2026-06-12,10:00,linkedin,"The enterprise feed vendors are not our competitor.
The spreadsheet is our competitor.

Every time I talk about positioning, someone asks what happens if the enterprise tier drops their price. The honest answer is nothing meaningful. The enterprise tier is not the incumbent we have to beat. The incumbent is the Google Sheet.

Roughly 60 percent of Shopify operators running three-plus channels are managing their feed in a spreadsheet. Another 15 percent are running the free first-party channel sync plus one-off apps and stitching the gaps in a spreadsheet. The remaining quarter is split between the enterprise feed engines, the self-serve peers, the legacy inventory platforms, and a long tail of single-channel apps.

The spreadsheet is free. It is flexible. It scales with the operator's willingness to spend a Sunday morning on it. It breaks at exactly the point we described in post two — 200 orders a day, four channels, one missed GTIN.

To win the wedge we do not need to beat the enterprise tier on features. They are in a different buying committee. We need to beat the spreadsheet on three axes: faster to set up, catches errors the spreadsheet cannot, and surfaces margin decisions the spreadsheet cannot ask.

Every feature we ship is tested against the spreadsheet first. If it does not beat the spreadsheet, it is not ready. If it clearly beats the spreadsheet, we usually beat the rest of the market by proxy.

We ship in 7 days. If you are still running a spreadsheet and you are tired of it — reply, DM, install. Whatever is easiest. See you on the other side.

#Shopify #Ecommerce #Launch #Multichannel","Week 8 Post 24 — POV — Visual: A split-screen image. Left: a chaotic spreadsheet with red cells. Right: a clean Palvento-style interface card with a green ""all checks passed"" badge. Arrow between them."
